{
  "schema_version": "TaskLeaseGuardCasesV1",
  "as_of": "2026-08-30",
  "sources": [
    {
      "source_id": "MCP-CORE-2026-07-28",
      "url": "https://modelcontextprotocol.io/specification/2026-07-28",
      "status": "RELEASED_CORE",
      "as_of": "2026-08-30"
    },
    {
      "source_id": "MCP-TASKS-EXTENSION-CURRENT",
      "url": "https://tasks.extensions.modelcontextprotocol.io/specification/draft/tasks",
      "status": "SEP-2663-FINAL_HOSTED-PAGE-DRAFT",
      "as_of": "2026-08-30"
    },
    {
      "source_id": "MCP-TASKS-2025-11-25",
      "url": "https://modelcontextprotocol.io/specification/2025-11-25/basic/utilities/tasks",
      "status": "RELEASED_EXPERIMENTAL_LEGACY",
      "as_of": "2026-08-30"
    },
    {
      "source_id": "MCP-AUTHORIZATION-2026-07-28",
      "url": "https://modelcontextprotocol.io/specification/2026-07-28/basic/authorization",
      "status": "RELEASED_CORE_OPTIONAL_FRAMEWORK",
      "as_of": "2026-08-30"
    },
    {
      "source_id": "MCP-ELICITATION-2026-07-28",
      "url": "https://modelcontextprotocol.io/specification/2026-07-28/client/elicitation",
      "status": "RELEASED_CORE",
      "as_of": "2026-08-30"
    },
    {
      "source_id": "MCP-SAMPLING-2026-07-28",
      "url": "https://modelcontextprotocol.io/specification/2026-07-28/client/sampling",
      "status": "RELEASED_CORE_DEPRECATED",
      "as_of": "2026-08-30"
    }
  ],
  "policy": {
    "minimum_entropy_bits": 128,
    "entropy_threshold_status": "LOCAL_POLICY_NOT_PROTOCOL_REQUIREMENT",
    "supported_profiles": [
      "released-core-2025-11-25",
      "current-extension-2026-07-28"
    ]
  },
  "cases": [
    {
      "case_id": "TLG-001",
      "name": "Negotiated released-core lifecycle",
      "category": "capability-and-lifecycle",
      "profile": "released-core-2025-11-25",
      "protocol_status": "RELEASED_EXPERIMENTAL",
      "spec_basis": ["MCP-TASKS-2025-11-25"],
      "fixture": {
        "declares_task_list": false,
        "events": [
          {"op": "negotiate", "task_methods": ["tools/call"], "task_cancel": true, "elicitation_modes": ["form", "url"], "sampling": true},
          {"op": "create", "method": "tools/call", "request_task_augmented": true, "task_id": "7f4b6e8c103d45f7a2c985b6d4e1f390", "id_issuer": "receiver", "auth_mode": "context_bound", "requestor": "alice", "context": "auth-a", "crypto_random": true, "entropy_bits": 128, "status": "working", "at_ms": 0, "ttl_ms": 10000, "poll_interval_ms": 1000},
          {"op": "poll", "task_id": "7f4b6e8c103d45f7a2c985b6d4e1f390", "requestor": "alice", "context": "auth-a", "at_ms": 1000, "served": true},
          {"op": "transition", "task_id": "7f4b6e8c103d45f7a2c985b6d4e1f390", "actor": "receiver", "status": "completed", "payload_digest": "result-a"},
          {"op": "result", "task_id": "7f4b6e8c103d45f7a2c985b6d4e1f390", "requestor": "alice", "context": "auth-a", "delivery": "tasks/result", "payload_digest": "result-a", "related_task_id": "7f4b6e8c103d45f7a2c985b6d4e1f390"}
        ]
      },
      "expected_outcome": "PASS",
      "expected_reason_codes": ["all_applicable_checks_passed"],
      "claim_ceiling": "Local synthetic released-core fixture behavior only."
    },
    {
      "case_id": "TLG-002",
      "name": "Undeclared current-request task capability",
      "category": "capability-negotiation",
      "profile": "current-extension-2026-07-28",
      "protocol_status": "DRAFT_OR_EMERGING",
      "spec_basis": ["MCP-CORE-2026-07-28", "MCP-TASKS-EXTENSION-CURRENT"],
      "fixture": {
        "declares_task_list": false,
        "events": [
          {"op": "negotiate", "elicitation_modes": [], "sampling": false},
          {"op": "create", "method": "tools/call", "server_extension_discovered": true, "per_request_client_extension": false, "durably_created": true, "task_id": "9fd3268e93b14772bdba41db7eec46d1", "id_issuer": "server", "auth_mode": "context_bound", "requestor": "alice", "context": "auth-a", "crypto_random": true, "entropy_bits": 128, "status": "working", "at_ms": 0, "ttl_ms": 10000, "poll_interval_ms": 1000}
        ]
      },
      "expected_outcome": "FAIL",
      "expected_reason_codes": ["undeclared_task_capability"],
      "claim_ceiling": "Local synthetic current-extension fixture behavior only."
    },
    {
      "case_id": "TLG-003",
      "name": "Guessed low-entropy task ID",
      "category": "task-id-security",
      "profile": "released-core-2025-11-25",
      "protocol_status": "RELEASED_EXPERIMENTAL",
      "spec_basis": ["MCP-TASKS-2025-11-25"],
      "fixture": {
        "declares_task_list": false,
        "events": [
          {"op": "negotiate", "task_methods": ["tools/call"], "task_cancel": false, "elicitation_modes": [], "sampling": false},
          {"op": "create", "method": "tools/call", "request_task_augmented": true, "task_id": "task-0001", "id_issuer": "receiver", "auth_mode": "none", "requestor": "local-user", "context": null, "crypto_random": false, "entropy_bits": 12, "status": "working", "at_ms": 0, "ttl_ms": 1000, "poll_interval_ms": 100}
        ]
      },
      "expected_outcome": "FAIL",
      "expected_reason_codes": ["insufficient_task_id_entropy"],
      "claim_ceiling": "Local synthetic detection of a predictable task-ID generator only."
    },
    {
      "case_id": "TLG-004",
      "name": "Cross-requestor result retrieval",
      "category": "requestor-binding",
      "profile": "released-core-2025-11-25",
      "protocol_status": "RELEASED_EXPERIMENTAL",
      "spec_basis": ["MCP-TASKS-2025-11-25"],
      "fixture": {
        "declares_task_list": false,
        "events": [
          {"op": "negotiate", "task_methods": ["tools/call"], "task_cancel": true, "elicitation_modes": [], "sampling": false},
          {"op": "create", "method": "tools/call", "request_task_augmented": true, "task_id": "c24818e2d6494c4bb0cc252a61aa28b0", "id_issuer": "receiver", "auth_mode": "context_bound", "requestor": "alice", "context": "auth-a", "crypto_random": true, "entropy_bits": 128, "status": "working", "at_ms": 0, "ttl_ms": 5000, "poll_interval_ms": 500},
          {"op": "transition", "task_id": "c24818e2d6494c4bb0cc252a61aa28b0", "actor": "receiver", "status": "completed", "payload_digest": "secret-result"},
          {"op": "result", "task_id": "c24818e2d6494c4bb0cc252a61aa28b0", "requestor": "bob", "context": "auth-b", "delivery": "tasks/result", "payload_digest": "secret-result", "related_task_id": "c24818e2d6494c4bb0cc252a61aa28b0"}
        ]
      },
      "expected_outcome": "FAIL",
      "expected_reason_codes": ["authorization_context_mismatch"],
      "claim_ceiling": "Local synthetic authorization-context binding behavior only."
    },
    {
      "case_id": "TLG-005",
      "name": "Context change during polling",
      "category": "context-binding",
      "profile": "released-core-2025-11-25",
      "protocol_status": "RELEASED_EXPERIMENTAL",
      "spec_basis": ["MCP-TASKS-2025-11-25"],
      "fixture": {
        "declares_task_list": false,
        "events": [
          {"op": "negotiate", "task_methods": ["tools/call"], "task_cancel": false, "elicitation_modes": [], "sampling": false},
          {"op": "create", "method": "tools/call", "request_task_augmented": true, "task_id": "046590ac49764f22a7cbd31e8896ad32", "id_issuer": "receiver", "auth_mode": "context_bound", "requestor": "alice", "context": "auth-a", "crypto_random": true, "entropy_bits": 128, "status": "working", "at_ms": 0, "ttl_ms": 5000, "poll_interval_ms": 500},
          {"op": "poll", "task_id": "046590ac49764f22a7cbd31e8896ad32", "requestor": "alice", "context": "auth-b", "at_ms": 500, "served": true}
        ]
      },
      "expected_outcome": "FAIL",
      "expected_reason_codes": ["authorization_context_mismatch"],
      "claim_ceiling": "Local synthetic context-change rejection only."
    },
    {
      "case_id": "TLG-006",
      "name": "Expired-task replay with retained state",
      "category": "ttl-expiry",
      "profile": "current-extension-2026-07-28",
      "protocol_status": "DRAFT_OR_EMERGING",
      "spec_basis": ["MCP-TASKS-EXTENSION-CURRENT"],
      "fixture": {
        "declares_task_list": false,
        "events": [
          {"op": "negotiate", "elicitation_modes": [], "sampling": false},
          {"op": "create", "method": "tools/call", "server_extension_discovered": true, "per_request_client_extension": true, "durably_created": true, "task_id": "9d43ba40d3e04783b0109148db81ce0e", "id_issuer": "server", "auth_mode": "context_bound", "requestor": "alice", "context": "auth-a", "crypto_random": true, "entropy_bits": 128, "status": "working", "at_ms": 0, "ttl_ms": 1000, "poll_interval_ms": 100},
          {"op": "poll", "task_id": "9d43ba40d3e04783b0109148db81ce0e", "requestor": "alice", "context": "auth-a", "at_ms": 2000, "served": true}
        ]
      },
      "expected_outcome": "UNKNOWN",
      "expected_reason_codes": ["expired_task_retention_unspecified"],
      "claim_ceiling": "The current extension permits but does not require deletion after TTL expiry."
    },
    {
      "case_id": "TLG-007",
      "name": "Cross-requestor result after cancellation",
      "category": "cancellation-and-custody",
      "profile": "released-core-2025-11-25",
      "protocol_status": "RELEASED_EXPERIMENTAL",
      "spec_basis": ["MCP-TASKS-2025-11-25"],
      "fixture": {
        "declares_task_list": false,
        "events": [
          {"op": "negotiate", "task_methods": ["tools/call"], "task_cancel": true, "elicitation_modes": [], "sampling": false},
          {"op": "create", "method": "tools/call", "request_task_augmented": true, "task_id": "47b7782246ae49bca2f93bbd0a8c7f53", "id_issuer": "receiver", "auth_mode": "context_bound", "requestor": "alice", "context": "auth-a", "crypto_random": true, "entropy_bits": 128, "status": "working", "at_ms": 0, "ttl_ms": 5000, "poll_interval_ms": 500},